{
  "$schema": "http://json-schema.org/draft-07/schema#",
  "title": "GapAnalysis",
  "description": "Structured analysis of gaps in current knowledge, technology, and practice that the proposed project addresses. Produced by the gap_analyzer agent.",
  "type": "object",
  "required": ["project_name", "gaps", "top_gaps_for_proposal"],
  "properties": {
    "project_name": {
      "type": "string",
      "description": "Matches runs/{project-name} directory"
    },
    "generated_at": {
      "type": "string",
      "description": "ISO 8601 date"
    },
    "gap_landscape_summary": {
      "type": "string",
      "description": "3–5 sentence narrative of the overall gap landscape this project addresses"
    },
    "gaps": {
      "type": "array",
      "minItems": 3,
      "description": "Individual documented gaps",
      "items": {
        "type": "object",
        "required": ["gap_id", "type", "sub_type", "description", "evidence_of_gap", "severity", "strategic_importance"],
        "properties": {
          "gap_id": {
            "type": "string",
            "pattern": "^GAP-[0-9]{3}$",
            "description": "Unique gap identifier: GAP-001, GAP-002, ..."
          },
          "type": {
            "type": "string",
            "enum": ["research", "technology", "application", "integration", "regulatory"],
            "description": "Primary category of the gap"
          },
          "sub_type": {
            "type": "string",
            "enum": ["studied-and-open", "not-studied", "solved-elsewhere-not-applied"],
            "description": "studied-and-open = known problem, no solution yet; not-studied = problem exists but uninvestigated; solved-elsewhere-not-applied = solution exists in another domain"
          },
          "description": {
            "type": "string",
            "description": "Clear, specific statement of what is missing"
          },
          "evidence_of_gap": {
            "type": "array",
            "items": { "type": "string" },
            "description": "source_ids that document the existence of this gap",
            "minItems": 1
          },
          "severity": {
            "type": "string",
            "enum": ["critical", "major", "moderate", "minor"],
            "description": "Impact of the gap on the field or on the target application"
          },
          "project_solution": {
            "type": "string",
            "description": "How the proposed project addresses or fills this gap"
          },
          "addressed_in_section": {
            "type": "string",
            "description": "Proposal section that should reference this gap (e.g. 'Section 1.1', 'Section 4.1b')"
          },
          "strategic_importance": {
            "type": "number",
            "minimum": 1,
            "maximum": 10,
            "description": "Importance for scoring under this call's evaluation criteria (10 = highest)"
          },
          "competitor_risk": {
            "type": "string",
            "description": "Any known project or publication that partially addresses this gap. Leave empty string if none."
          }
        }
      }
    },
    "top_gaps_for_proposal": {
      "type": "array",
      "items": { "type": "string" },
      "description": "Gap IDs ranked by strategic_importance (highest first) — writers should prioritise these",
      "minItems": 1
    },
    "criterion_gap_mapping": {
      "type": "object",
      "description": "Maps evaluation criterion IDs (from evaluation_matrix.json) to the gap_ids that support scoring under that criterion",
      "additionalProperties": {
        "type": "array",
        "items": { "type": "string" }
      }
    }
  }
}
